Url,Text,Author
https://vk.com/wall-34963413_421757,"Поясняю за 530д ф10 дорест 
 
Тут уже были мои посты про красную е90 и почти черную е39…времена идут, хотел написать этот текст раньше, но не доходили руки 
 
ПОКУПКА:
 
Сказки друзей-дизелистов порядком давили на ум и возможность экономить (ездя на бмв, ага, них*я ж себе). А супруга каждый раз очень уж выразительно смотрела, когда на М3 (к сожалению, это трасса, а не модель моей тройки) койлы давали знать о себе на каждом мосту после Калуги. 
Решил купить или е70, или ф10. Смотрел и то, и то. Но больше тянуло к 5ке. Во-первых, потому, что я так-то вижу поребрики и умею в них не въезжать (если кто не знал, многие покупают кроссоверы якобы для удобства парковки у поребриков) , во-вторых, ну ё-мае, какой офрот на иксе, потом его остатки еще в зил вкорячивать, а смысл от покупать кроссовер, кроме как использовать его на местах, где нет дорог как таковых, я не вижу, можно купить универсал же (не, как парню из деревни, выросшему на Бумере мне реально очень хочется черный Х5, но когда я думаю логически: зачем оно мне надо? То необходимость икса себе обьяснить не могу). Еще немаловажная причина— это то, что все-таки е70 это визуально (внутри) очень похоже на тройку е90, на которой я ездил, знаю, что сейчас под постом ты напишешь, что я дебил и отличий там хренова гора, но в целом картинка для меня схожая. А эфка все-таки следующий шаг по дизайну, есть ощущение, что ты купил другую машину. И плюс у меня есть принцип/желание, чтобы каждая следующая машина была быстрее предыдущей, что с иксом (смотрел онли 3л дизель то и, то) можно, но сложно. 
 
Описывать творящийся ужас на рынке данных авто не буду тк он точно такой же, как и у любой другой модели. Нашел, купил. Купил у пожилого темщика, с прикольными номерами, к сожалению, не моего города и поэтому ушедших в недра хранилища МРЭО, машинка была битая за свою жизнь. И спереди, и сзади…но совсем чуть-чуть. Экологию уже украли. По комплектации комфорт седла, широкий монитор, доводчики дверей, автодальний свет (хз как его врубить даже, но так написано), цвет черный сапфир, вроде и все. Мотор 57й какой-то там генерации на 245 сил и с одной турбинкой , коробка тоже какая-то автоматическая, почему-то в отличии от прошлых машин – пофигу какие именно у меня модицикации чего-то из внутренних частей.
 
ВЛОЖЕНИЯ:
 
С мая по сентябрь 2021 года 
- Цепи (со всем остальным, что к ним идет + работа) = в районе 90к. Запчасти орига по околооптовым ценам. Большинство сервисов в мск попросит примерно 100-120к. И будут против того, чтобы запчасти заказали вы сами. Многие работы ниже по ценнику писать не буду, тк остальное делалось в дружественных серваках. 
- Задние тормозулки – Зиммерман (я могу ошибаться в названиях, ибо не фапаю на это все и заказываю в основном по телефону), слышал, что они испортились вроде, хз, поменял и когда нажимаю на тормоз – тормозит. В районе 5к за диск, их 2. 10к 
- Колодки - хз че за фирмы, заказанные не подошли, купили в ближайшем брейкшоп что-то, что было в наличии: не орига, но и не стеллокс – честно не помню. В районе 7к в круг. Тоже тормозят норм вполне. По ценам – цена на е90/е60 + 1к 
- Ступичные подшипники 2шт вроде был брал FAG и вроде бы по 8к. 
- Патрубок на бачок охлаждающей жидкости оригинал бмв – 4,5к. 
- Клапанная крышка мотора бмв орига 28к. 
- пробка бачка со фризом бмв орига – 1.2к 
- помпа орига бмв 7700. 
- ребилд форсунок 8к, мне надо было 3шт 
 
Ну и прочие масла, фильтра каждый тут уже др**ит, как говорится, как хочет. Но для примера нужно в нее 2 канистры по 4л покупать, я беру ликви моле молиген стоит 4-5 за канистру (как попадешь на акции и скидки). Из моего списка почти все самое дешевое, что можно ставить на нее (тормоза вынести за скобки тк вкусовщина). То есть если можно поставить неоригинал без ущерба по качеству или адекватности (у меня был знакомый, который декоративные накладки всякие в багажник ставил оригу, я куплю самый дешевый китой тк это просто пластик, мне без разницы). Но есть узлы автомобиля, которые должны быть оригинальные. А есть аналоги, которые по качеству не уступают оригиналу, или уступают незначительно. 
P.S. Пишу на память цены, где-то могу подсоврать. 
 
КАК ТАЧКА: 
 
После е90 – земля и небо. Причем в обоих смыслах. Не едет нихера, рулится хуже, тормозит тоже хуже. (б*я, я понимаю что е90 тройка, а ф10 пятерка, это лишь мои ощущения после покупки!) Почему стоит так дохера – хз. Армяне на мойке почему-то стали брать 1200 вместо 700 за комлекс. Почему обслуга стоит как свап в е90 – хз. Это из минусов. 
Из плюсов: комфорты бмв – это что-то нам данное из будущего. Просто сидел на работе и думал как скорее сесть в свой кантрабас. Доводчики тоже очень понравились…я думал, что это для ушлепков, которые в каком-то там Крае унитазы золотые ставят. Ну типа…ты че дверь закрыть не можешь в машине своей?))) Но ошибался, это очень кайфовая штука, только ты начинаешь ненавидеть людей, которые не закрыв дверь начинают ее открывать во время работы доводчика и твое сердце получает шрам. Автоматический ручник – тоже нужная опция, почему раньше не додумались до этого? (ездил на всяких тачках чуть старше, где уже стояночный тормоз кнопкой, но этой функции нет). Это мои мысли и мой восторг человека, который 5 лет назад мечтал о восьмерке. Мб на новом киа к5 (лучшем из авто) этим никого не удивишь, но парень их деревни кайфует от таких плюшек. 
Но если сухо: тачка удобная, мягкая, по шумке меня устраивает, но, допустим, шумнее заметно каена 2ген с двойным стеклопакетом. По салону меня сначала разочаровала, тк сев в нее никакого wow-эффекта не было, хотя в том же каене был. Но потом ездя то на ф10, то на каене, понял, что в эфке салон в целом намного удобнее и продуманнее. А в ваге просто понтуются россыпью кнопок. И опять же, сравнивая с каеном, в разы удобнее мультимедия и штатная навигация (на ваге с разряженным телефоном с гостиницы «Украина» ехал на чистые – еле выжил. ) 
Поэтому, когда не ездил на эфке (она была где и все бмв – в сервисе) очень скучал. Плюс: ее реально уважают, не в смысле, что отдают тебе деньги, но во дворе намного меньше затыкали по ночам, чем красную е90. В узком месте почти всегда сразу сдают назад. Да и на платках – на е90 можно обморгаться – но не уедет мудила с левой полосы. Тут достаточно только увидеть летящую в жопу черную баржу на глазках – многие уезжают. Кстати, напиши в комы, как относишься к умникам, которые тошнят по платке 100 в левом ряду при пустом правом, мне кажется у таких людей с девушками проблемы или какая-то детская травма, ну я других причин не могу найти… 
Качество сборки по салону ничего не скрипит, пластик хороший, но есть ощущение, что качество упало по сравнению с и 39, и даже с е90. Ну, а гениальное изобретение по заливу прикуривателя кофе или водой - придумал очень гениальный баварский инженер. 
Багажника хватает человеку, который не занимается перевозками грузов, а возит там скейт, рюкзак и пакет с ленты. 
В 4м в машине весьма комфортно, пятого никогда не сажаю и вам не советую. В путешествиях не затекал никто. Весьма удобно поглощать километры по трассе. Расход 5-6 трасса соблюдая скоростной режим, 7-8 на скорости 150-160. И 10-11 когда за рулем суетолог ежже. Если по деньгам, то на 3л е90 на поездку Москва – Брянск – Москва выходило 5к, а на дизелюке этот же марштрут где-то под 3к. 
Машина в общем, классная, но она как немецкая камри. И мое сердце обливалось кровью, я хотел выставить ее на продажу. Тк не хочу камри, хочу бмв. Ну не давала она эмоций от вождения, жмешь газ…ждешь,ждешь и тут что-то произошло. Я был как Эрик со своей новой М5 (самого необычного золотого цвета, спасибо, что прививаешь нам вкус дядя) – был разочарован и обманут. Я люблю БМВ за другое, как фанаут марки, примирится с серостью и скукой, мне не хотелось.
 
КАК ТАЧКА 2.0.
 
Чип, мать его, тюнинг. Во-первых, турбина не дула,видимо, она была не Юрий, а какой-то Гаррет, следовательно дуть не собиралась. На самом деле посечена песком крыльчатка тк какие-то гамиды не вовремя меняли фильтр воздушный, посему ехала тачка как овощ в районе 7.5 первую сотню. Я купил контрактную турбину (найти турбину на 245 сил – еще та задача, отличаются выходными фланцами, у 245 она под быстросьем, на 258 сил – нет. Когда покупал я, была единственная турба в рф на 245.) И хоть новая (контрактная) турба была тоже Гаррет, но она подула так, что я ПРОСТО ОХ**Л. 
Всего это мероприятие с заменой, прокладками турбы, удалением в экологии того, чего не удалили до меня, и чипом вышло в районе 45к, плюс турба 30к. 
И она стала НАСТОЯЩЕЙ БМВ (простите ребята на кастрированных версиях – считаю, что это не совсем тру баварцы ИМХО.) Влюбился в эту машину по настоящему. Она будто и рулиться в потоке стала лучше – это с одной стороны самообман, с другой, вариативность под правой ногой позволяет действовать с запасом при езде в потоке. Колесами 285ми буксует на секунду до первой сотни на стабилизации. Ускорение до 200 вполне уверенное, первую сотню ощутимо быстрее 330 е90, 100-200 примерно так же, хз тк редко разгоняюсь до 200 на ней. 
И сейчас, на мой взгляд, это идеальный дейли кар. Быстрый, удобный, технологичный (да, десятилетний технологичный автомобиль), и приятный авто. 
 
Если кому-то это поможет в покупке – буду рад. Фото с инета.",id181405745
https://vk.com/wall-34963413_421706,"по просьбам трудящихся пояснялово за ГАЗ-69. 
в 2006 году мой батон прикупил один из нескольких газонов, на котором я езжу по сей день. гнал до Питера своим ходом из Череповца на трёх горшках. стоил он тогда в районе 3к зелени плюс сверлильный станок. абсолютно живой кузов, на то время ещё живая рама и все что на ней есть. за все время на нем стоял родной м-20-й двигун, православный 402, опять родной, и сейчас 417-й. Кузов дважды перекрашивался, один раз капиталился родной мотор, менялись мосты, тормоза, провода и по кругу навеска. но обо всем по порядку! 
на этом козле я езжу уже лет 8. при мне был положен мотор, по причине кривых рук молдован, которые закосячили масляный насос и 69-й стал субарём с конченым 4 горшком. зимой 18 года он дал клина, заменил на 417, который мне отдал приятель. 
в 2017 ГТЦ сказал, что ему пора на покой. из Выборга в Питер гнал на ручнике. спустя полгода поставил вояки, передние тормоза с газели и ГВУТ с волги 24 (да-да, тот самый, на который не где найти дитоли, но важно было сохранить педали в пол). на таком конфиге камни и колеи перестали быть чём-то заметным для газона, хотя тапки стоят 30 ат гудрич. в глине делать нечего, но даже самую лютую геометрию проходит на пониженной как по асфальту по прямой. пока уазоводы покупают киты на понижение 3 и больше, тут с завода идёт 2.78. холостые на первой пониженной и он ползёт медленнее мамки с коляской. 
три передачи, третья прямая. в городе можно спокойно ездить на второй и третьей. в потоке держаться сложно, не хватает мотора. прямой передачи в раздатке нет, там 1.15 на повышенном ряду, плюс редуктора в мостах с небольшим понижением. поэтому приходится вальяжно бздеть по городу и ловить взгляды от мала до велика. каждая остановка сопровождается несколькими объективами в свою сторону, подходят старики просто поболтать и рассказать как они на таких служили, мужики кидают респект. и за это простительно все, что касается динамики, все-таки машина для другого, и с этим другим справляется на отлично. таскать машины из кюветов, прицеп с кубом брёвен в горку, возить 12 человек в кузове и далее по списку. кстати, полноценных места всего два - спереди, сзади в кузове две скамейки по три места, под ними рундуки для барахла. в целом места хватает с запасом для любых задач. расход около 12-14 по трассе если ехать 90-100, в городе под 20. понятное дело, что машина не на повседнев, потому и не жалко залить под завязку бак (которых два, один под сиденьем пассажира, что добавляет нотки остроты и риска для ценителей), и сгонять на залив или просто покататься по Питеру, ловив взгляды и бибиканье водителей. 
на каждое 9 мая с семьей одеваемся в форму и даём круг почета по всем районам города, с остановками для мелюзги, которая с восторгом лазает по газью. 
зимой можно ездить в куртке и в одной перчатке на левой руке, печка жарит как надо, ногам тепло, полный привод тащит даже на атешке. остановиться несложно, главное не резко. 
из недостатков могу отметить, что штатный цпс не рассчитан на постоянно включённый ближний свет, поэтому пришлось ставить разгрузочные реле, спалив два цпс-а. 
по запчастям сейчас проблем особо нет, однако качество современных деталей просто ни о чем, особенно электрика. кузовню можно заказать новодел, можно взять на авито. что-то подходит от уаза. только с тентами беда - новодел является конченым шлаком, а оригинал либо стоит космос, либо высохший, что не натянуть. 
сейчас в планах махнуть раму, поставить гур, ибо геометрию проходит ценой сломанных пальцев и вывихнутых кистей. также есть планы на каркас безопасности, потому что крыши нет, единственное, что может спасти при перевертыше - рамка лобового. 
в целом что могу сказать: если нравится машина - покупайте с живым кузовом и рамой. никакого внешнего колхоза - забудьте про музыку, нештатные фонари и жесткую крышу - это машина со своей спецификой, именно в родном исполнении она притягивает взгляды. но будьте готовы к тому, что может сломаться что угодно в любой момент - это норма для старых машин. поэтому возить с собой карб, преды, топливный насос, трамблер и катушку со свечами - обязательно. добавлю, что штатная система контактного зажигания надежнее автомата калашникова, после пары лет простоя заведётся с двух прокрутов стартером. переводить на электронную не советую. 
и сразу рубрика для знатоков - на втором газоне, который я собираю в полную родню есть проблема - не качает помпа, мотор кипит на холостых. менял помпу, чистил блок, менял радик, снимал и ставил термостат - давления нет, верхний потрубок горячий, нижний холодный, вода стоит на месте. мотористы чешут репу, ничего не могут сделать. памагити!1!",id35609241
