Url,Text,Author
https://vk.com/wall-34963413_424292,"Здравствуйте, уважаемые. Много букв, сразу скажу. Повествование раскину на две части: основную и лирическую. 
Toyota Scepter 2.2 5s-fe at 1995 год. Пробег 253ткм.
Что интересно, Скептеры все реэкспортные, их делают в США. 

Плюсы: 
Вместительная. Багажник здоровенный. 
2.2 на 140л.с. и 190Нм момента более-менее тянет(согласно тачке, которой 26 лет).
Чудес ждать не стоит. 
130км/ч - 3000об. Держит дорогу хорошо, ехать комфортно, торопиться и хасанить не хочется. 
В этом кузове ставился ещё 3.0 1mz-fe, там, думается, вообще хорошо передвигается автомобиль. 
Мотор вроде хвалят ""знающие"" люди, но этот чуть не помер. 
Акпп тоже хвалят. Живучая. Пока не померла. 
Тачка мягкая на ходу, задняя многорычажка збс. На высокой резине просто кайф, полицейских лежачих проходит мягенько, ямки-стыки тоже. 
Стеклоподъёмники, зеркала - электро. 
Настройки отопителя салона - крутилки(хотя в нете видел, в основном кнопки у всех). Кондей. Есть типа салонного фильтра под потолком сзади в салоне(гоняет воздух через блок фильтров). 
Салон велюр, бежево-коричневый, приборка приятно-мягкая на ощупь. 

Минусы:
Расход от 13л. Но 92ого.
Акпп туповатая, но то ж древний 4х ступ.
Проблема с вибрациями на 5s - нихуя не редкая проблема. В сети смотрю, и компенсаторные валы вынимал кто-то, и опоры менял... Обычно меняют машину.
Иногда нихуя непонятный ценник на зч. Особенно оригинальные. Но, думаю, это логично, тачка уже сралитет. 
Пружины передние так и не нашёл, от виндома сильно высоко, от харриера пиздец высоко. От остальных не подходит место соприкосновения пружины и опоры пружины на стойке(блюдце, чашка, хуй знает как оно зовётся). 
Очень длинная морда, передний номер выебан весь, упирался часто в заборы и тд. 
Головной свет говно. Но то норм для древнего ведра. 
 
Лирика. 
Такая истрия: батя передал мне бразды правления тойотой, которую он пользовал 19 лет.
Купил в 2001ом, единственный владелец в РФ(перекуп-перегонщик не в счёт), ездил до 2019го.
Итак, Toyota Scepter 2.2 at 1995 год. 5s-fe. Пробег 253ткм.
19 лет провела в Якутске, на зиму батя её ""замораживал"" в огороде. Родители собрались валить оттуда, тачку батя решил подогнать мне. Хз зачем, я вообще думал, что это шутка, блть. У меня уже было 2 некрухи на тот момент: Suzuki Samurai 83г. и vw golf 4 2001 на тот момент.
Тачка збс. Мотор - часики, едет-стелит-ахуеть. Так, мелкие коцки присутствуют. Это все батины слова.
Приехал я за ней в МСК и прихуел. Она, сука, вся разноцветная(оттенки), крыло заднее гниет(хотя, в принципе, это единственная ржа/гниль была).
По дороге уже всплыли другие косяки... Воняет бензином, ебашит вибрация от мотора на весь кузов и салон, тормозным дискам плохо, морда перезадрана, подвеска отрабатывает лево-право неравномерно, стучит че-то, упоры капота вытекли, упоров багажника нет, гидрач ссыт, на колёсах гайки представлены ассортиментом из 5 вариантов, руль ""гоночный""... Магнитола кассетная(не орига😒), за сиденьем нашёл кассету, дай, думаю приколюсь: вставляю, а она херак! и провалилась в недра магнитолы. 
Но, тем не менее, из МСК до СПб домчали по платке без гемора, даже 150 на обгон ходил. 
Перебрали подвеску. Сука, корка: спереди стояли стойки разной длины + скомпенсировано разными по высоте поставками. Заменил аморты перед/зад, пружины зад заменил. Пружины перед не нашли нихуя, но батя недавно (вроде) менял, пильнули по витку. Ну и всякие мелочи, рулевые наконечники и тд. 
Сзади, слава богу, живая многорычажка. Диски тормозные в помойку, понятное дело. 
Текла форсунка. Через корпус. Ахуеть. Орига 5к за штуку. Купил ребилд с алиэкспресс, 2500р за 4шт😬 Одна из них текла тоже. Купил б/у в итоге. Попутно вскрылось, что в одном горшке компрессия 7, в остальных 12.5. Пиздец, приехали. Я думаю, повлияли факторы: маленький город, узкие и короткие улицы, миллион светофоров, пенсионерский стиль вождения. Мотор тупо закоксовался. Отмочили митсубисевской химозой, не помню, как называется. Слава богу, получилось. А то я уже пригорюнился, думал, продавать это ведро как есть. За пачку макарон, сука. Крыло вскрыли, вварили ремонтную вставку, покрасили. В далёком 2001 тачку чинили во владике где-то, как я понимаю, последствия ремонта вылезли. Руль нашёл сток на авито, поставил. С аирбэгом, который работает от замедления, без датчиков, короче. Упоры капота и багажника нашёл на фарпосте в новосибе новые. Гидрач все так же подссывает, похуй. Поставил диски от крауна и резину 205/70/15. Тачка высокая стала(такой я колхозник, ага, всегда вкатываю максимально большие колеса на небольших дисках). Вот с вибрацией я нихуя не решил. Подозреваю, что нарушена геометрия кузова(лонжероны, пол, подрамник), ибо мотор стоит ""колом"", не шелохнется, а так быть просто не может. Есть бешенная просто вмятина в полу, аж в салоне бугор, со стороны переднего пассажира. Это батя ночью в луже ехал, не зная фарватера... Якутск, хуле. Поставил б/у опоры мотора от camry 20, 2 шт. Они гидравлические. Орига стоит 20+тыр за штуку. Радик родной(орига был) порвало в пробке, датчик на вентилятор сдох, он не сработал и пиздец. Купил новый за 6к. Ещё была тема, если дождь идет(а в Питере это норма), тачка утром не заводится, пока трамблёр феном не прогреешь. Или в лужу влетишь ходом, тяга пропадает, троит, двоит, глохнет. Решилось заменой прокладки крышки трамблера. 
В принципе, сейчас тачка более-менее в рабочем состоянии. 
И самое забавное, что в итоге я забрал у жены шкоду фабию(другую ей купили), у бати тоже есть машина тут, а тойота как бы не удел... Но продать жалко. Да и я за год сотку туда вкинул. Жалко вдвойне. Оставили её как ""хозяйку-подменялку"".",id199434
https://vk.com/wall-34963413_424240,"Всем привет. Первое пояснялово.
День товот так что держите. Долго думал накалякать но что то, то времени то настроения то ""сломаны пальцы обоих рук""...
Пояснялово за Тойота Супра А70(3 поколение) рест,широкая( после нее та самая из форсажа). Последний год выпуска, пруль,3л турбо, ватомат,темс,тарга,кожа, короче довольно жирная. Минус один- она отжата. 
Ценник был 150 без торга в состоянии заехала в гараж сама,теперь не заводится. 
Сухо по поколению: 1500 кг(толстая), моторы 2;2.5(легендарный);3(батя легендарного), АКП 340е или мкп 57го поколения и легендарные 154е. Опционно ЛСД темс тарга диджидаш. 
Вес варианта с АКП и 3л мотором 1570кг
Приколюхи: 
Темс-электронно регулируемые аммо, зажимает амортизаторы при газ/тормоз/руление. 
Тарга - съемный кусок крыши над передними сиденьями.
Диджидаш- ламповая приборка на вакуумных индикаторах.
Опыт эксплуатации
Начну с минусов.
Это то самое некро со всеми вытекающими. Отъебывает все,не смотри что Тойота. Возраст и нещадная эксплуатация предыдущих владельцев. Тачка была с горелым сцеплением(да,свапнута на меху), бустконтроллером, лысой резей,кривыми торм дисками и начинала гнить.
Слабые места кузова: задние подкрылки по швам,ниша запаски. Живые они очень редко. Пороги внутри.у меня ещё рамка окна сверху и мелкие жуки везде(30лет машине).темс аммо на нее нет. Даже бу в раб сост.мотор 3л 7м гте, славится пробоем прокладки. Есть инфа что на бусте вообще голову отрывает(в прямом смысле),но я не оч поверил. 
Не едет. Вес/мощность ниочем.
Рулежка. Это ГТ. Это не гонка. Комфорт да спорт нет.
При нормал режиме подвески едешь как на Волге. И это не всратые аммо, это у всех так. В спорт режиме подвески получше.
Тарга кузов играет и совсем отнимает какие то спорт амбиции.
Запчасти.
Все что шло только на неё стоит как на новую Ино, если в хорошем сост. 
Много чего приходится выкапывать из недр форумов и сообщества.
Много деталей сложно найти.
Если хочешь ездить комфортно, то салон не 5тиместный,а скорее 2+2. Сзади только дети или собака(или если хочешь почувствовать себя собакой).
Вроде все.
Плюсы. 
Можно найти на ходу и не дорого (ибо довести до состояния стоит оч много)
Такая только у меня и у Майкла Джексона.
Для меня это самый красивый кузов из супр. Несмотря на слабые места кузов жирный и прочный. Откровенно дырявые редко встречаются.может вымерли.
Комфорт. Не хочется выходить.
Когда поменял торм диски и резину- хорошо рулится, очень предсказуемо(но не остро). 
Турбо мотора хватает для свободного исполнения на 2й и если умеешь- на 3й передаче.
ЛСД по мокрому даёт особые ощущения, только проваливается если перегазуешь.
Тех часть подходит от многих тойот тех лет(Марк,соарер) и в целом надёжная,даже сильно б.у. 
Мотор если не брать прокладку- по надёжности как Джей. Но раскачивать его сложнее. 
2литра есть ТТ,есть компрессор sc14. 2.5 тот самый Джей на ТТ.
В потоке моторов хватает, для комфортного передвижения,не для гонок со светофора(я не про Джей). Надо обогнать,проскочить или успеть под мигающий- легко, но светофорные гонки проигрывает даже не самым новым Ино.
Мануал.
Отдельное слово про tsrm toyota supra repair manual. 
900+ страниц. 10см толщиной книга А4 двухсторонней печати (я себе распечатал)
Очень подробно в картинках. Только не все(диджидаш не нашел).
Резюме:
ГТ как оно есть. Ехать куда то далеко и комфортно очень приятно. В городе немного неповоротливо,но это скорее эффект ожидание/реальность, так то даёт прикурить многим кузовам.Жалко старое это все, стоит в гараже чаще чем ездит,но мне очень нра.",id251069652
https://vk.com/wall-34963413_424049,"Ну, хули, раз день тоет, поясню за toyota rav4 2016 г. Мотор 2.0 бензин 3zr-fe 146 лс, механика 6 ст, полный привод. Искал именно 6 МТ полный привод, так как 2.0 на автомате это вариатор. А 2.5 с гидромеханическим автоматом не потянул бы по деньгам. Куплена в 2018 году двухлетней с пробегом 23тыс. На данный момент наезжено до 70 тыс. 

Поломки: покупал с потёртым кожзамом на руле, руль поменяли по гарантии на новый и через 20 тыщ он стал таким же затертым. Непонятно. Диски штамповка зимняя тоетовская ржавеет быстрее тазика. Заменено на литьё. И тормозные диски родные стираются быстро. В остальном все ок, проблем нет. То раз в год и все. Масло не жрет, хотя 3zr этим славится.

Расход: трасса 90 кмч - 6.0л, трасса 100-110кмч - 7.0л, 120кмч-8 л, 140 и выше расход улетает в космос, зашкаливает. Главное ехать машина позволяет 140-160 кмч спокойно и лишь к 180 уже не очень уверенно, но расход отбивает все желание, езжу сотку. Город 9-10л в самом идеальном случае без пробок а так скорее 12л.

Мотор, коробка: не самый быстрый, но для повседневной езды хватает, при этом жрет бенз. Мотор эластичный, но без всплесков, эмоций и подхватов, можно ехать и 1300 об мин на 4-5-6 передаче, фазовращатели позволяют, но супер тяги нет нигде. До 3 тыс об несколько вяленько, после 3 порезвее, но опять таки тяга ровная. На 6 передаче 120кмч -3 тыс оборотов, тянет 6 передачу херово. 5 заметно резвее. Первая передача очень короткая, между ней и второй, второй и третьей огромные провалы и это бесит. А вот 4-5-6 очень сближены. На обгоне выбор передач большой. 

Подвеска: упругая, сбитая, весьма короткоходная, местами даже тряская, но 160 кмч можно мчать спокойно держа руль одной рукой, даже двумя пальцами. Этому способствуют и колеса 18е.

Салон: широкий, места сзади и спереди много даже за 188 см водителем, сидушки складываются в ровный пол, ночую на природе в машине, велосипеды без переднего колеса можно напихивать по 3 штуки. Местами какая то непонятная экономия. Нет подсветки бардачка. В Жигулях была а тут нет. Подсветка багажника какая то ублюдская и нет подсветки кнопок стеклоподъёмников, как авторежим только водительский. При этом есть подогрев руля, сидушек, всего лобового стекла, электропривод двери багажника и складывания зеркал.

Проходимость и полный привод: машину выбирал именно с полным приводом во чтобы то ни стало. Все обычно членососят электромагнитные муфты полного привода, но тут её достаточно выше крыши. Полный привод с электронными имитациями межколесных блокировок позволяет многое, зимой заезжаю в крутые подъемы, без проблем паркуюсь в нечищенных дворах, езжу через заснеженное поле и даже можно покрутить пятаки на 1-2 передаче. Короче полный привод более чем достойный, быстрее упиртся в геометрическую проходимость, бампера и глушак висят низко. Муфту можно перегреть но это если минут 10 буксовать когда уже и так понятно что надо вылезать и копать.

По итогу: тачка нравится хотя косяки и присутствуют. Менять особо не на что, только если на какой нибудь Киа Соренто на дизеле, но это надо вливать вечно деревянные, так что едем дальше.",id36953430
