Url,Text,Author
https://vk.com/wall-34963413_416833,"Приветствую вас, уважаемые ПЗТшники. 
Вашему вниманию представляется Honda Accord 4 поколения. 
Сейчас я вам расскажу повесть о любви и счастье, о горе и печали. 
Все началось в 19 году, когда я будучи школьником, который уже сдал на права, облизывался на любое авто, так как на права-то я сдал, но не мог получить, ибо не было на тот момент 18-ти лет.
Все лето на пролет я усердно работал, попутно глядя на Авито любые варианты тачек в пределах 60 с копейками тысяч, которые я планировал заработать, с завистью смотря, как мои сверстники либо просто пинают мужские детородные органы, либо пропивают свою ЗП. Но я уверено шел к своей мечте. Так и вышло, в копилке за лето скопилось 65 тысяч.
Подходила дата получения прав и я все также листал Авито и мечтал о своем личном авто. С другом ездили и смотрели варианты различных ВАЗов, но каждая из них была крайне уставшей. А жигули я не рассматривал, так как для меня было абсурдом было брать жигуль за 60+. Каждый новый день я дёргал друга, чтоб он в случае покупки подогнал тачку к дому, где она б ждала до тех пор, пока я не получу ВУ. 
Шло время, я наконец получил заветные права и мой отец решил сделать мне подарок и вручил мне 20к на день рождения, чтоб я наконец взял себе что-либо, так как видел он печаль мою, после каждой поездки просмотра авто. Но с условием того, что теперь я буду по сути его личным таксистом время от времени. То есть различные поездки в деревню, в соседние города, да и иногда по мелочи по городу падали на мои плечи, так как в семье я первый, у кого появилось авто. Для меня все это было пустяком и я даже рад был лишний раз проехаться. По сей день я благодарен отцу за его помощь и поддержку. 
Повысив на Авито пограничную сумму на глаза мне попалась она: белая хондочка в ""карбоновой пленке"", без каких-либо шильдиков за дикие 80к. Сразу набрал хозяина и отправился смотреть её со своим товарищем. После беглого осмотра поняли: движок контракт, арки едят бобры, на капоте шпакля, хрустит граната, полностью отсутствует музыка, дубликат дубликата и кучу других нюансов.
Но я не мог с собой ничего поделать, она запала мне в душу. Переспав после этого дня одну ночь с влажными снами, я всё-таки решился - нужно брать.
Приехал, а хозяин уже снял стремную пленку, вернул шильдики, поменял лобовуху с трещиной. Поторговавшись до 70к, оформили документы и пожали руки. Словами не передать то чувство, которые я испытал тогда, когда в мою голову с запозданием пришла мысль о том, что теперь эта баржа моя. 
Ну а теперь пробегусь бегло по ее описанию:
Авто представляет из себя чудо японской инженерии 1992 года в бомж комплектации, что поставлялась на европейский и муриканский рынок. То есть черные матовые бампера и зеркала, весла сзади и нерабочие стеклоподъёмники спереди, двухлитровый карбовый двиган на 133 полуживых пони, что жрал порядка 10 л. в условиях города и 8 л. по трассе, благо повезло, что он не жрал масло и доливать его приходилось гораздо реже, чем моим друзьям, имелся ГУР, бензонасос, что редко капризничал, толстый и гниющий металл, 4 двери, 4 штампа, шины на которых дрались из-за кривого сход-развала, был лишь один коврик (потом собрался полный комплект из 2-ух жиговских, 1 из-под лачетоса и один оригой под педалями) и тысяча и одна проблема с ходовкой, электрикой, кузовнёй. Но это все было для меня мелочью, ведь наконец моя мечта исполнилась и теперь я мог разъезжать на своей ласточке. Я не любитель какого-либо ""тюнинга"", поэтому никак не планировалось закатывать ее в бункер, занижать, ставить лютые сабы. В этом мои вкусы расходились со вкусами друзей и почти каждого среднестатистического юного автовладельца. Поэтому остаток учебного года день за днём я подъезжал к своей школе на аквариуме, в котором играла слабенькая музычка, а вечером неспеша и без лишней суеты были лайтовые поездки с девушкой по городу.
В течение долгого времени почти вся ходовка постепенно пошла под замену. Менялись ШРУСЫ, шаровые, всевозможные рычаги, ступичные подшипники, тормозные колодки и куча всего разного, чего я уже и не помню, так как утекло достаточно времени. Из-за того, что бабок у меня было не особо, чинилось все по чуть-чуть и не сразу. Оттого она она постепенно сыпалась, за что друзья ласково прозвали её Отрыгой. Признаться честно, ожидал, что цены на запчасти будут высокими, а на деле оказались не сильно дороже ладовских.
После 11 класса устроился на работу и каждую зарплату вкладывал в нее: ребята из малярки восстановили кузовню: арки спереди и сзади, капот. 
Приобрел 15-ые дисочки с шинами на авито и накинул на неё.
С друзьями в гаражах поставили средненькую акустику, разобрались с электрикой и починили стеклоподъёмники, поставили антенну, которая выдвигалась по кнопочке. Собственноручно перешивал чехол на КПП, полировал панельку и делал кучу мелочей, которые просто радовали мою душу.
С тех пор для меня и моего круга друзей она перестала быть Отрыгой и перевоплотилась в Белоснежку. 
Каждый день я катался на ней и не знал предела своего счастья. Раз в неделю намывал её, раз в две недели менял вонючку в салоне. Оставался посидеть в ней подольше после того, как приезжал домой. Оглядывался на нее перед тем, как зайти в подъезд. Никак не описать те чувства, которые испытывал я, когда круизил по городу со своими друзьями. 
Но тут пришло время испытаний для нее: ей нужно было добраться от Чебоксар, до Ростова-на-Дону, куда мою пятую точку потянули приключения и универ, куда я поступил. Путь предстоял недолгий и весьма некороткий: порядка 1500км. Поэтому перед таким путешествием Белоснежка побывала на на диагностике, где я получил перечень деталья, что нужно было махнуть. Все работы заняли порядка трёх дней и чуть меньше 6к.
Настало время переезда. Готовился я к худшему раскладу. Ну а к чему ещё готовится, когда собираешься проехать пол рашки поперек на мамонте 90-ых годов не имея за спиной даже года стажа?
Но к удивлению она была будто рада таких выходкам. На трассе держалась славно, будто вгрызались в асфальт. Жрала топлива в пути как положено, без лишних затрат. И на второй день такого путешествия я был уже в Ростове, где я ее оперативно помыл.
Все было славно до тех пор, пока я не пришел к осознанию того, что я здесь не нуждаюсь в ней: универ, магазины, места досуга были в шаговой доступности. Сверстников моего возраста с авто тут банально не было и покруизить как у себя на родине компанией не представлялось возможным. Людей у которых были интересы такого рода тоже не было среди моего окружения. 
Да и наслаждения от поездки было получить сложно: движение тут гораздо хуже, дороги печальнее, со знаками творится лютая ересь. Вы б видели, моё удивление, когда я увидел что тут про поворотники будто не знают.
Потом было очередное путешествие в Старый Оскол за 600 км, от Ростова. (1200км в сумме на дорогу туда-обратно) Это приключение она тоже пережила без проблем. Были ещё различные путешествия за город и по городу, и все обходилось. Но роковым для нее стало путешествие в Азов, а точнее возвращение из него. На выезде из города я влетел в КамАЗ, так как банально не увидел знак. У Хонды снесло пол морды, но не задело её жизненно важных органов. Да и не пострадал никто, лишь девушка отделалась испугом, особенно КамАЗ, которому я лишь поцарапал покрышку на его прицепе...
После этого казуса я влетел в лютую грусть и печаль на пару месяцев. Ездить никуда вообще не хотелось, так как один её вид чуть ли не резал мое сердечко, а глаза наполнялись слезами и отнюдь не оттого, что туда что-то попало.
Вот и по сей день это чудо стоит на парковке и я не знаю что делать. Чинить? А смысл, если я ей не пользуюсь и она стоит просто так, собирая пыль? Да и нужны на это деньги, которые достать во время учёбы предоставляется проблематичным. Продавать? Возможно ли это сделать с таким неликвидом, так ещё и битым? Да и к тому же это больно: я будто своего верного друга предам, с которым было куча эмоций, приключений и много проведенного времени.
Дорогие ПЗТшники, берегите своих ласточек, любите их и будьте аккуратнее на дороге.
За сим, откланиваюсь и благодарю всех, кто дочитал до этого момента.",id150539571
https://vk.com/wall-34963413_416656,"Настало время охуительных историй, дружок-пирожок, присаживайся поудобнее и готовься читать многабукаф, ведь сегодня я поясню тебе ни много ни мало за вилочный погрузчик. Ты полюбас катался на этой штуке в аэропорту Лос-Сантос и наверняка она запомнилась тебе всратым управлением. 
Ну как положено сначала немного истории. Самой конструкции лет чуть более чем дохуя, уже сильно более ста, первые прообразы появились в конце 19 века, а к нынешнему форм-фактору пришли уже к 50м годам. Конструктивно представляет собою мощную раму на которой с одной стороны закреплен противовес, а с другой установлена так называемая мачта. Как и у любой спецтехники существует масса различных вариаций для погрузки всего, от пиздюков на тонну до гигантских ублюдков таскающих морские контейнеры, но в данном пояснялове рассмотрим обычный такой себе усредненный погрузчик, типичного обитателя склада. 
Бывают они и дизельные и бензиновые и электрические, в зависимости от задач и условий работы, и это реально та сфера где электрички давно и плотно работают на равных с углеводородными перделками, так сказать наступившее будущее. Используют электрички конечно в основном в помещениях где нежелательно устраивать газовую камеру, а по улице шустрит техника с двс. 
В связи с устройством погрузчика, езда на нем требует привыкания, ведь спереди стоит мощный мостяра, жестко (!!!) закрепленный на раме, а сзади качающаяся поворотная балка на шкворнях. То есть фактически подвески на нем как бы и нет, поэтому ездить по хуевому покрытию это к отбитым почкам, да и вообще фактор вибрации, учитывая что ты в прямом смысле сидишь верхом на моторе, он прям ощущается особенно на дизелях. Бензинки работают мягче и к ним можно припиздячить газ, чем многие и пользуются. Комфорт внутри отсутствует так же по причине отсутствия остекления на большинстве экземпляров, если у тебя есть закрытая кабина и печка, то ты уже белый человек и большего желать сложно. 
Далее переходим к тому, ради чего собственно все это сделано, к мачте. Бывают они одно двух и трехсекционные, и на них вешаются самые разные приблуды начиная от банальных вил до захватов для бочек, различных штырей для длинномеров и сложных зажимов для крупногабаритной бытовой техники например. Управляется все это дело гидравликой, умеет двигаться в нескольких плоскостях. Помимо прямых обязанностей эта штука еще и полезна в быту, с его помощью я регулярно переобуваю машину используя как домкрат и поднимая сразу один бок, времени экономит изрядно. При желании можно использовать и как подьемник задрав машину целиком, на фото можно глянуть как это присходит) 
Как уже писалось выше, в связи с конструктивом управление отзеркалено по осям, и ощущается это как езда на обычной машине только время задом, ведь управляемая ось-задняя и механической связи с колесами нет, руль полностью гидравлический. Зато тут есть такой выворот, что дрифтерам и не снилось, практически под 90 градусов, что дарит нам лютейшую маневренность и возможность развернуться практически на месте. Так же в активе мы имеем автоматическую коробку передач на подрулевом джойстике, одна передача вперед, одна назад, охуенно удобно выезжать в раскачку из сугроба в который ты заехал по тупости. 
Пожалуй пару слов о рыночке и буду закругляться. Тут все в целом просто, японцы делают вещи и в лидерах числится божественная тавота (тот случай когда техника рил достойная и стоит своих деняк), на хвост им наступают немцы с мультибрендовой Kion Group и замыкают тройку американцы из NACCO Industries. Кетай как и везде за последние 20 лет сделал охуенный прогресс, но по оборотам пока уступает лидерам в 4 с лишком раза, а по качеству, ну сами понимаете. Когда в 2009 году я торговал китайскими джаками (та самая контора что сейчас толкает нам свои легковушки) был очень показательный случай, приехал по гарантии погрузчик которому было 3 месяца, перестал заводиться. При вскрытии выяснилось что на распредвале сточило кулачки полностью, то есть совсем. И это лишь один пример хоть и с поправкой на время, есть и очень неплохой китай но и стоит он обычно уже не как китай. Как бы с авторынком аналогии вполне проглядываются. 
Так, ну вроде все обсосал, бонусом глядите культовое видео про водителя погрузчика Клауса, это превосходный хоррор о технике безопасности и долбоебах. 
Засим откланиваюсь, мир вашему дому, здоровья погибшим некрухам, до новых встреч в эфире, посоны.",id371764294
https://vk.com/wall-34963413_416544,"Всех приветствую.
Мужчины, пожалуйста, расскажите особенности владения и содержания навары и л200 (4 поколение). Я понимаю, что технически это пафик и паджеро, но интересны именно особенности пикапа.
Или, может быть, кто-то предложит альтернативу, кроме патриота. Как вариант смотрю на сангйонг экшен спорт турбодизель, но о них знаю только то что пишут в интернете.

Совершенно не имеют значения внешний вид и статусность автомобиля. Важнее способность доехать куда надо мне (без фанатизма) и выехать обратно. 2 взрослых, 2 детей, немецкая овчарка. Из барахла с собой как у всех: лодка, мотор, палатки, спальники и т.п. И питбайк для 10-летнего баламута 😄

Всем огромное спасибо, качественного топлива, дорог поровнее, налогов пониже и побольше позитива в жизни.
________________
Маздафорд.",id17692751
https://vk.com/wall-34963413_416408,"Тут такое дело. Грэйт Волл сделали Русский Прадо.

Рама, двухрычажка впереди, мост сзади, твин-турбо в6 в 3 литра, и восьмиступенчачтый автомат.

Соллерс тем временем сделал традиционное НИ-ХУ-Я.",public34963413
https://vk.com/wall-34963413_416330,"Господа, соизвольте пояснить за e90/91/92/93 на дизельном дрыгателе. Стоит ли брать в 2021-22? Какие основные болячки и интересные моменты с этой бричкой связаны?",id166877424
