Url,Text,Author
https://vk.com/wall-34963413_428204,"Что видят люди, глядя на эвок 1 поколения? Красивый, стильный, сравнительно недорогой кроссовер, мечта девочек и творческих глиномесов, чей раздолбанный тузец перестал влезать в MINI. 
Что видит фанат марки, ездивший на нормальных ЛР? 
Всратый шмат чистого убожества, беззастенчиво ссущий в озеро элитарности Land Rover и Range Rover в частности.
Первое поколение эвока - это кровавый выпердыш маркетологов, которые заправили жирный, толстый и потный хуй защеку всем фанатам марки, поставив во главу угла моднявый дизайн, похерив весь арсенал традиционных плюх ЛР, жа которые их и любят. 
Как-то загнав свой фрил в сервис, я получил на подмену эвок в жиру. Купе, панорама, дизель 190сил. 
Я был счастлив, потому что техника реально красива и вызывала у меня неподдельный интерес на фоне консервативного фрилендера. 
Первая реакция:
Кайф! Красиво, стильно, современно!
Выехал на дороги- супер. Острое управление, взгляды собираешь стабильно (в 2013ом эта тачка была магнитом для внимания окружающих) 
Но все быстро закончилось и полезли косяки. 
В чем прелесть ренджей? В том, что они могут одинаково круто себя проявить во всех дисциплинах. 
Оффроуд, дальняки, городской траффик и все это в совокупности с необычаянным комфортом. Шильдик обязывает. 
А эвок? 
Индивидуального подлокотника нет. 
Левый локоть закинуть на традиционную полку оконную нельзя. Она высоко. Спустя 4 часа за рулем этой тачки ловишь себя на мысли, что спина и плечи побаливают, сидухи жестковаты и сам ты утомлен. Обзорность шляпа. Проходимость неплохая, но это и близко не уровень ЛР. Капитанской посадки нет, сидишь где-то на уровне водителя солярки. Салон непрактичен и неудобен. Подвеска жестковата- стыки на трешке выбешивают до жути. 
Если рассматривать эвок в вакууме, в отрыве от марки, это просто симпотный паркетник. Но если ты фанат марки, если знаешь как должен себя вести автомобиль с шильдой LR, то тебя ждут жопные боли и непроходящее ощущение, что тебя где-то основательно наебали. 
Я уже молчу, что технически эвок это рескин испорченного фрила. Та же коробка, те же движки. В ресте коробке докинули ступеней. 
После того, как я сменил обратно эвок на фрила, я ощутил себя в раю. Мягко, комфортно, высоко, уверенно и легко. 
К чести марки, они свои косяки поправили в новом поколении. Новый Эвок это укороченный велар со всеми вытекающими. А велар охуенен и о нем я закину пост позже",id35629795
https://vk.com/wall-34963413_427970,"Если ты еще не читал мое пояснение по фрилендеру, то начни с него, потому что это сиквел.
А что, если у тебя больше денег, чем на фрилендер, хочется всего того же, но больше?
Слышал поговорку ""жадность фраера сгубила""? Ликуй, дружище, она не про тебя, ибо и по твоей улице проехал инкассатор.
И имя ему Range Rover Sport в первом поколении, рест. Да еще и комплектация HSE, да еще и обвес автобиография, да еще и 13 года, когда вовсю уже продавался новый кузов.
А это значит ты не из тех бомжей, что купили стоящий на коленях ренджак за пицот. Ты из тех бомжей, которые купили за почти-некро за полтора-два. 
Теперь ты можешь запарковаться на смотровой, опустить пневму и присесть на багажник, покуривая кальян с таким пафосным ебальником, будто у тебя как минимум нефтянная вышка или хинкальная в спальном районе, на худой конец. (Илюша, шалом) 
...
Но давай ближе к скучному конструктиву:
 1. Дизайн. Это современная классика. Он не стареет. Он прекрасен в своей завершенности.
 2.Все плюсы, что я перечислил для фрила актуальны и тут. Только каждый умножь на 2. Он комфортнее, он красивее, он брутальнее, он технологичнее. 
 3.Салон. Посадка ""гибридная"". Вроде как капитанская, но чуток в горизонталь уходит. Но фирменный, царский комфорт присутствует. Более богатый и приятный салон тоже. А шумоизоляция- мое почтение. Двойные стекла, кстати. 
 4.Как он едет... вообще это стоило сказать еще в пояснении на Фрилендер. То, насколько породисто едут автомобили LR - очень тяжело объяснить человеку со стороны. Причем это справедливо как для флагманских моделей, так и для бюджетного фрила. (исключения - старые дефы и эвок первого поколения) 
Они не едут. Они утюжат. Это двухтонные всесокрушающие утюги, которые проминают под собой любое покрытие и ненасытно пожирают километры, конвертируя их в чистое, незамутненное удовольствие для водителя. И он едет по любому покрытию настолько уверенно и борзо, что иногда начинаешь переживать, что пока ты спишь, он может сам по себе захватить Польшу или взять на таран авианосец и нассать на басурманский F16
Представь, что ты сидишь на кресле качалке у камина. В левой руке у тебя стакан самого лучшего виски или коньяка. В правой руке сигара, из лучшего табака, скатанная на бедре потрясающей мулатки. Ты в дорогущем шелковом халате на голое тело. Распахнутом. А в ногах у тебя, стоя на коленях на шкуре белого медведя стоят Анджелина Джоли и Моника Белуччи в лучших своих годах. И они играют в камень-ножницы-бумага, за право первой тебе отсосать. 
Вот, что такое езда на полностью исправном и ухоженном рендж ровере 3-4 или РРС 1.
И при этом, он все тот же сверх-универсальный автомобиль, на котором можно и в говна, и в высший свет, и в дальние пробросы. Он умеет все, и он во всем хорош без всяких компромиссов. 
Если фрилендер мне позволял проехать 2000км без остановок, но уже уставшим и сонным, то в РРС я проезжал это же расстояние абсолютно свежим и полным сил. 
А еще он рамный. Это не плюс, не минус. Просто факт. Коробка живет ровно столько, сколько ты ей позволишь. Будешь аккуратен - пройдет дохуя. Нет- чуть меньше. 
Пневма что на ррс, что на рр, что на диско 3 и 4 надежна. Эпоха стоящих раком на пневме ренджей ушла давно и безвозвратно. Поколения квадратных LRлв последних лет выпуска отточено и пролечено. И надежность их напрямую коррелирует с уходом и заботой, поэтому не вздумай экономить. 
Двигатели: 
 1. старые атмосферники забудьте. Некруха отжаренная
 2.Более свежие бензинки. Атмо и компрессор. Охуенные. Надежные. Эмоциональные. Но налоговые и жрущие. Если ты можешь себе позволить содержание такого авто на повседневе, у тебя точно есть бабки на тачку посвежее, чем первый спорт
 3. Турбо-дизель 3.6 достаточно надежен. Если найдешь в хорошем сохране тачку с таким движком - бери, не задумывайся. Минус- это налог. Он малость перевалил за 250 коней. 
 4. Чуешь? Чуешь эти мурашки, которые пробежали про твоему лохматому анусу? Ты понял о чем сейчас пойдет речь: великий и ужасный 3.0 турбо-дизель. Тот самый, у которого ломает коленвал без всяких предпосылок на лютом рандоме. 
Но давай подробно и по факту: двигатель охуенный. В салоне не слышен почти, тяговитый, эластичный, полка момента ровная до 160-170. Экономичный- 11 в городе, 6,8 на трассе при езде 90км/ч на круизе. 
А это тот же заветный шаг в 1000км по трассе. Подхватывает с самых низов этот движок очень приятно и породисто. 
А теперь к его проблеме с коленом. 
Да, колено ломает. 
И ты попадаешь на капиталку. 
Качественно и с гарантией ремонт сделают только в 1 сервисе страны. И там очередь на пару месяцев. И стоит это пол ляма. 
Из-за чего это происходит: колено ломает после проворота вкладышей. А те проворачивает из-за хуевых зазоров и перегрева. Была попытка пофиксить проблему, сделав эти вкладыши на ""замочках"", но не сработало. 
Можно ли этого избежать? Да. 
 1. Очень внимательно следи за системой охлаждения. Возлюби ее, как ближнего своего. Люби, цени и ухаживай. 
 2.Не гарцуй. Хоть у него и есть приставка ""Sport"" в названии, LR не про навал и суету. LR это про сочетание запредельной уверенности в любых условиях и невероятного комфорта. За его рулем, ты успешный батя, который ленивым взглядом скользит по суетологам на приорах. Даже SVA с 500-сильным компрессорным движком настроен на деликатный, аккуратный разгон. 
 3.Делай ТО раз в 8000км, заливай не поддельное масло и качественный дизель
Прими идеологию марки, правильно обслуживай спорта, присматривай за системой охлаждения. 
И будет тебе счастье. 
У меня за 240 000 км менялись только мелочи. Коробка, двигатель, турбина, пневма- все работало на момент продажи ровно так же, как и на моменте покупки. 
Автомобиль великолепен. И я по нему очень тоскую. 
У каждого из тех, кто любит тачки и застал нормальные машины, а не этот одноразовый хлам, собранный из переработанной туалетной бумаги, есть своя сокровенная модель, которую он когда-то ""непременно купит"", чтобы восстановить до заводского состояния и кайфовать. 
У меня это RRS. Точно такой же, какой был у меня. На фоне опыта с более чем 50 автомобилями в свои 30 лет.
Владение ухоженным RRS первого поколения в ресте, это жаркий, бешенный и страстный роман с полным взаимопониманием и нескончаемым конфетно-букетным периодом, пока окружающие погрязли в рутине.",id35629795
https://vk.com/wall-34963413_427815,"Рамный, надежный, рокочущий, веселый и злой внедорожник с актуальным дизайном в богатом фарше за 750к - существует, но его у тебя никогда не будет.
....
Чем хорош дорестовый nissan pathfinder в 51 кузове? У него есть охуительный мотор V6 4.0
Но он скучно-рубленный снаружи и чудовищно уебищный внутри.
Чем хорош рестовый? Его кузов оброс мускулистыми гранями, а салон приобрел благородный вид.
Но его богический 4.0 бенз сменил максимально ублюдский 3.5 дизель, а эта железка- ебанашка со стажем. Ломается как мразь, непрогнозируемо, внезапно и безвозвратно. 
Но есть редчайшее исключение. И это он, арабский паф
Был куплен в 2007 году в ОАЭ. Общий дизайн внешки и салона рестайлинга, за редкими исключениями, вкупе с тем самым 4.0.
Но, допустим, звезды сошлись, ты довел до струйного оргазма всех престарелых гадалок своего крыжопля, и они указали морщинистыми пальчиками на место, где такой можно купить. И ты все-равно в пролете. Почему? Потому что они гниют. У 9 из 10 пафиков всея Руси нутро гнилое, как сердце генерала Шепарда и трусоватость ДИМОООООООНА из ""бумера"" вместе взятые.
Почему же у моего бывшего ни грамма ржи? А потому что он не видал суровых зим и реагентов, катаясь по Северной Осетии-Алании.
Чем еще отличается этот экземпляр от других? Широкой площадкой на заднем бампере, фактурной крышкой 5 двери и парой доп.показателей на приборной панели.
Традиционные плюсы и минусы, начнем в плюсов:
 1. Двигатель. Он надежен, неприхотлив и зол. В сочетании с 5-ступенчатой коробкой, нажимая педаль в пол, ты получаешь злющий пинок под хвост, паровозную тягу и ощутимые, олдскульные переключения передач. И это охуенно. Кажется, что динамика НАМНОГО реще скромного паспорта. Для сравнения, его прямой конкурент прадо с похожим v6 4.0 разгоняется очень мягонько, плавненько и скучно.
 2.Подвеска. Она плотная. Даже жестковатая. Но вместе с тем, этот бегемот может на очень внушительных скоростях залетать в поворот как по рельсам, как не снилось ни патрулям, ни крузакам, ни прадикам. А наблюдать за охуевающими от разрыва шаблона глазами водителей на светофорах, когда ты в живописнейшем зимнем дрифте выходишь боком в поворот, с громким рычанием атмосферника и фонтанами снега камшотишь их лобовухи- бесценно. И да, тут можно ездить чисто на заднем приводе. 
 3.Кожа и пластик. Выносливы. Сидушка под моей 100кг-ой жопой не просела, кожа не потрескалась и не порвалась за 11 лет в семье. Кнопки не затерлись, а салон не заселили сверчки. Кроме одного. В сидушке пассажира. 
 4.Комплектация LE- кожа-рожа, люк, музыка BOSE, камера заднего вида, 4 зоны климата на 3 ряда сидений. Садишься в машину- руль и кресло съезжаются. Доводчик 5ой двери. Датчики давления в колесах и тд, и тп. 
 5.Багажник. Огромный, как твои кредиты и жопа никки минаж. Если опустить 2 и 3 ряд сидений, получается ровный пол. А объем пространства такой, что там можно смело основать порностудию и снимать масштабные генг-бенги. Про обычный траходром и двуспальнуюю кровать я вообще молчу. 
Минусы:
 1. Расход. В городе цифра 20 будет обычным делом. А бак эмиратского пафика в 60л заставит часто закатывать на азс. На трассе реально выжать 8.5
 2.Бензиновых машин мало, они заналоговые, на 270+ лошадей. А дизеля говно. 3.5 абсолютное зло, а 2.5 в ОЧЕНЬ ухоженном виде еще может поездить
 3.Клуб владельцев пафиков. Это пиздец, дамы и господа. Ебаная секта Бога Кузи. Каждый владелец будет визжать до хрипоты о том, насколько богический это автомобиль. А все они ездят на дизелях. И если зайти в клуб владельцев ПФ, то стена этой группы затмит знаменитую стену плача. Сплошные глюки и поломки. И не дай бог ты спизданешь что-то лишнее, отряд святой инквизиции тут же объявит тебе православный джихад под грохот рвущихся пердаков. 
 4.Шлейф подушек безопасности в руле стабильно отрыгивает на пробегах 120-150+, и ошибка подушек назойливо будет моргать, пока не поставишь оригинал. А неоригинал живет очень недолго. 
 5.Сидушки. Никакой геометрии, в городе терпимо, но на дальняках спина запросит пощады очень быстро.
....
В мире современных унисекс-турбожужжалок, бензиновый R51 это олдскульный накаченный байкер в белой майке алкоголичке, заправленной в джинсы, с трехдневной щетиной и татуировкой конфедерации, который заходит в веганское кафе, выкуривает пачку мальборо с одной затяжки, выпускает дым в лицо щупленькому официанту-пидорку с уебищным модным хвостиком на макушке , который в ужасе теряет сознание и разливает по полу огуречный смузи; закидывает на плечо самую сочную телочку в заведении и уходит с ней в закат, показывать реальную жизнь.
Да, он давно не в тренде, но он один из последних, настоящих, олдскульных и максулинных сукиных сынов, которые умеют зажигать с настоящими эмоциями.",id35629795
